{
  "version": 1,
  "output": { "width": 1080, "height": 1920, "fps": 60, "crf": 19 },

  "boost": {
    "enabled": true,
    "text": {
      "font_file": "fonts/CapCutStyle.ttf",
      "small_label": "+12",
      "big_label": "+100",
      "color": "#33CCFF",
      "outline_color": "#000000",
      "outline_width": 4,
      "position": { "anchor": "near_gauge", "x_offset": 0, "y_offset": -40 }
    },
    "animation": {
      "pop_duration_ms": 150,
      "start_scale": 0.7,
      "overshoot_scale": 1.1,
      "settle_scale": 1.0,
      "fade_in_ms": 60,
      "hold_ms": 400,
      "fade_out_ms": 200
    },
    "sfx": { "small": "sfx/boost_small.wav", "big": "sfx/boost_big.wav", "gain_db": 0 }
  },

  "goal": {
    "enabled": true,
    "effect": "slowmo",
    "sfx": { "file": "sfx/goal.wav", "gain_db": 0 }
  },

  "captions": {
    "enabled": true,
    "language": "en",
    "words_per_chunk": 4,
    "font_file": "fonts/CapCutStyle.ttf",
    "base_color": "#FFFFFF",
    "active_color": "#FFD400",
    "outline_color": "#000000",
    "outline_width": 4,
    "position": { "anchor": "lower_third", "y_offset": 0 },
    "animation": { "pop_in": true, "pop_duration_ms": 120 }
  },

  "thumbnail": {
    "enabled": true,
    "image_file": "templates/twitch_badge.png",
    "position": { "anchor": "top_left", "x": 24, "y": 24 }
  },

  "music": {
    "enabled": true,
    "file": null,
    "gain_db": -8,
    "duck_under_voice": true
  },

  "audio": { "normalize_lufs": -14, "true_peak_db": -1.0 }
}
